{"device_id":"fc0fbb65-15b4-4cff-aa88-a692aca2edb8","paired_at":"2026-10-19T14:23:38Z","schema_version":1,"scopes":["catalog","read","download","receipt"],"source_id":"67c008aa-36d6-4261-8ae2-df7bf3a76c92","spki_sha256":"d4da3a41911daaa25d621576de640d41c263b99c381de17cf1ea40fbd825b0fd","token":"WlpaWlpaWlpaWlpaWlpaWlpaWlpaWlpaWlpaWlpaWlo","token_type":"bearer"}