{
  "schema_version": 1,
  "source_id": "5a1e0c3e-7d2b-4c1a-9f00-000000000001",
  "device_id": "00000000-0000-4000-8000-000000000d01",
  "token": "Zm9yLWZpeHR1cmUtb25seS1ub3QtYS1yZWFsLXRva2Vu",
  "token_type": "bearer",
  "scopes": [
    "catalog",
    "read",
    "download",
    "receipt"
  ],
  "spki_sha256": "511ddc12fa17b03c69fccac42cee5e5d631ed0f1be38ec7a0957da0059843a43",
  "paired_at": "2026-10-06T09:02:13Z"
}
