{"device_id":"52041174-3ad2-4e84-a7e8-c9277763abc2","paired_at":"2026-10-12T03:02:23Z","schema_version":1,"scopes":["catalog","read","download","receipt"],"source_id":"d195c96e-351b-473c-b320-1e2785469ded","spki_sha256":"46e9935870b038ad2f238d80e97f7fff5e535d3457aa433ff3f6435e066c3ac3","token":"WlpaWlpaWlpaWlpaWlpaWlpaWlpaWlpaWlpaWlpaWlo","token_type":"bearer"}