{"device_id":"f3c2a301-39e5-41cc-b558-1c56797fbc97","paired_at":"2026-10-19T04:24:31Z","schema_version":1,"scopes":["catalog","read","download","receipt"],"source_id":"3c7da7ef-6e6c-47e8-bee0-eaa66fa15ba4","spki_sha256":"e6ab28404ecec02aa681d501d429eaaba05672f49a934d2d28c68c5e9a5f1235","token":"WlpaWlpaWlpaWlpaWlpaWlpaWlpaWlpaWlpaWlpaWlo","token_type":"bearer"}